{
  "id": "M6.E10",
  "legacy_row": [
    "`M6.E10`",
    "**shipped** — `v0.1.40`, 2026-09-10",
    "`/sig:drive` can take a step: it asks how to run, and floors fire on conditions, not phase names."
  ],
  "migration_note": "Recorded as closed (legacy) when unit records were added: a person confirmed the list it was in. Found: its milestone row says shipped (MILESTONE-6.md:32: “**shipped** — `v0.1.40`, 2026-09-10”); its retrospective is complete (.planning/M6.E10-RETROSPECTIVE.md); today's closure check reads it closed (M6.E10-VERIFICATION.md records a PASS, and M6.E10 is not the current unit).",
  "events": [
    {
      "type": "closed",
      "at": "2026-10-12",
      "by": "migration",
      "reason": "legacy",
      "words": "over before unit records existed; recorded when they were added"
    }
  ]
}
