{
  "id": "M6.E6",
  "legacy_row": [
    "`M6.E6`",
    "**shipped** — 2026-09-04; core in `v0.1.37`, REVIEW fixes in PR #236",
    "The decision queue gets a writer: `routeDecision` + `/sig:drive` as its first caller."
  ],
  "migration_note": "Recorded as closed (legacy) when unit records were added: a person confirmed the list it was in. Found: its milestone row says shipped (MILESTONE-6.md:28: “**shipped** — 2026-09-04; core in `v0.1.37`, REVIEW fixes in PR #236”); its retrospective is complete (.planning/M6.E6-RETROSPECTIVE.md); today's closure check reads it closed (M6.E6-VERIFICATION.md records a PASS, and M6.E6 is not the current unit).",
  "events": [
    {
      "type": "closed",
      "at": "2026-10-12",
      "by": "migration",
      "reason": "legacy",
      "words": "over before unit records existed; recorded when they were added"
    }
  ]
}
