{
  "id": "M6.E8",
  "legacy_row": [
    "`M6.E8`",
    "**shipped** — `v0.1.41`, 2026-09-25",
    "`/sig:advise` ranks on the sources it reads and says which it consulted; retrospectives dropped as a source."
  ],
  "migration_note": "Recorded as closed (legacy) when unit records were added: a person confirmed the list it was in. Found: its milestone row says shipped (MILESTONE-6.md:30: “**shipped** — `v0.1.41`, 2026-09-25”); its retrospective is complete (.planning/M6.E8-RETROSPECTIVE.md). Also found: today's closure check reads it as one it cannot determine (M6.E8 has 1 terminal artifact(s) but none states a readable verdict (M6.E8-VERIFICATION.md)).",
  "events": [
    {
      "type": "closed",
      "at": "2026-10-12",
      "by": "migration",
      "reason": "legacy",
      "words": "over before unit records existed; recorded when they were added"
    }
  ]
}
