{
  "id": "M6.E3",
  "legacy_row": [
    "`M6.E3`",
    "**shipped** — `v0.1.42`, 2026-09-27 (parked 2026-08-20, reopened around Jev 2026-09-26)",
    "The claims-audit backstop, rebuilt around TypeSafe's Jev: advice with receipts, never a refusal. 3447 → 3602 tests. August material in [`archive/M6/E3/`](archive/M6/E3/)."
  ],
  "migration_note": "Recorded as closed (legacy) when unit records were added: a person confirmed the list it was in. Found: its retrospective is complete (.planning/M6.E3-RETROSPECTIVE.md). Also found: its milestone row says shipped and also \"parked\", so the row is not counted (MILESTONE-6.md:25: “**shipped** — `v0.1.42`, 2026-09-27 (parked 2026-08-20, reopened around Jev 2026-09-26)”); today's closure check reads it as one it cannot determine (M6.E3 has 1 terminal artifact(s) but none states a readable verdict (M6.E3-VERIFICATION.md)).",
  "events": [
    {
      "type": "closed",
      "at": "2026-10-12",
      "by": "migration",
      "reason": "legacy",
      "words": "over before unit records existed; recorded when they were added"
    }
  ]
}
