{
  "id": "M6.E12",
  "legacy_row": [
    "`M6.E12`",
    "**shipped** — `v0.1.45`, 2026-10-02",
    "`/sig:advise` and `/sig:drive`'s pick step propose 3–5 big-picture priorities from a cited digest and ask; age removed."
  ],
  "migration_note": "Recorded as closed (legacy) when unit records were added: a person confirmed the list it was in. Found: its milestone row says shipped (MILESTONE-6.md:34: “**shipped** — `v0.1.45`, 2026-10-02”); its retrospective is complete (.planning/M6.E12-RETROSPECTIVE.md). Also found: today's closure check reads it as one it cannot determine (M6.E12 has 1 terminal artifact(s) but none states a readable verdict (M6.E12-VERIFICATION.md)).",
  "events": [
    {
      "type": "closed",
      "at": "2026-10-12",
      "by": "migration",
      "reason": "legacy",
      "words": "over before unit records existed; recorded when they were added"
    }
  ]
}
