{
  "id": "M5.E9",
  "legacy_row": [
    "**E9**",
    "✅ shipped as **v0.1.12** (2026-07-27) — **ran ahead of E8** (D-M5E9-2)",
    "**Linear mode can ship; the phase ledger becomes an honest log.** Closed `B41`–`B45` — all four of the originating bugs reported from **outside** Signal's own use, not found by its suite. **`B42` (P1):** a project with no Epics could not run `/sig:ship` **at all** — live since v0.1.3 across nine releases, invisible because Signal-on-Signal has been Epic-mode since M4.5.E11. Retro gate is now **Epic-only** (D-M5E9-1). **`B43`/`B44`/`B45`:** three defects stacked in `state.js:388-395` — a SHIP date was unrecordable (SHIP is terminal), set semantics collapsed a multi-run ledger silently, and unvalidated entries became permanent phantom phases. **`B41`:** the four middle commands now transition at entry. **`[BREAKING]`** `completed_phases` is an append-only log of the current run that **trims** (linear → `STATE-HISTORY.md`; Epic → archive on roll, before the reset). 1623 → **1652 tests**; proof-of-fail by baseline replay (**16 of 22 new tests fail on the pre-Epic code**). REVIEW **PASS-WITH-FIXES** — 1 **Critical fixed in-phase**: the new sweep check told *every healthy project* its history had been destroyed; removed rather than re-tuned, because a past collapse **is not detectable from the file**. New: `B46`, `B47`. Decisions D-M5E9-1…7. Retro: [`M5.E9-RETROSPECTIVE.md`](M5.E9-RETROSPECTIVE.md)."
  ],
  "migration_note": "Recorded as closed (legacy) when unit records were added: a person confirmed the list it was in. Found: its milestone row says shipped (MILESTONE-5.md:37: “✅ shipped as **v0.1.12** (2026-07-27) — **ran ahead of E8** (D-M5E9-2)”); its retrospective is complete (.planning/M5.E9-RETROSPECTIVE.md); today's closure check reads it closed (M5.E9-VERIFICATION.md records a PASS, and M5.E9 is not the current unit).",
  "events": [
    {
      "type": "closed",
      "at": "2026-10-12",
      "by": "migration",
      "reason": "legacy",
      "words": "over before unit records existed; recorded when they were added"
    }
  ]
}
