{
  "id": "M5.E17",
  "legacy_row": [
    "**E17**",
    "✅ shipped as **v0.1.15** (2026-08-01) — **ran ahead of E10–E12, E14–E16**",
    "**Instructions that contradict other instructions.** Three Signal instructions disagreed with another Signal instruction, or with ratified practice; nothing compares one instruction against another, so two documents can give an agent conflicting orders indefinitely and only a live run reveals it. Fixed: **`ship.md` referenced a commit that no step created** (four steps staged \"into the SHIP commit\"; `markFresh` sat at §5.3 ahead of all four, so it stamped a pre-commit HEAD **by construction** — observed live during M5.E13's own ship); **`verify.md`/`review.md` stated no `markFresh` ordering at all** (silent, so the agent picks); **`review.md`'s verdict table contradicted two shipped Epics** (*\"FAIL \\| Any Critical\"* in three places while M5.E9 and M5.E13 both shipped PASS-WITH-FIXES with a Critical closed in-phase — the rule was miscalibrated, not the practice, **D-M5E17-1**). Added: **`plan.md` now schedules first-use in wave 1** — *\"shipped but never run\"* is Signal's best defect predictor (`B54`, `B39`, `B42`/`B53`, `B48`, `B55` all surfaced on a first execution, all late). **`ship.md`'s direct-to-main self-exemption removed** — it was written 2026-05-26 and **thirteen releases shipped under it with exactly one PR in that span**; the gate now lives in a GitHub ruleset (`D-M5E17-4`, `D-M5E17-5`). 1806 → **1822 tests**. **Two of this Epic's own ACs were satisfiable by a no-op and were re-executed in corrected forms** — recorded openly. New `B56` (P3). Deferred: the 48-entry inbox triage → **M5.E14** (`D-M5E17-3`). Decisions D-M5E17-1…5. Retro: [`M5.E17-RETROSPECTIVE.md`](M5.E17-RETROSPECTIVE.md) — **backfilled 2026-08-03 from commit messages, the CHANGELOG and `B71`, not written at close**; `/sig:ship` was never invoked for this Epic and no `PROGRESS`/`VERIFICATION`/`REVIEW` exists. See the note below the table."
  ],
  "migration_note": "Recorded as closed (legacy) when unit records were added: a person confirmed the list it was in. Found: its milestone row says shipped (MILESTONE-5.md:40: “✅ shipped as **v0.1.15** (2026-08-01) — **ran ahead of E10–E12, E14–E16**”); its retrospective is complete (.planning/M5.E17-RETROSPECTIVE.md). Also found: today's closure check reads it open (M5.E17 has no terminal artifact — nothing claims it finished).",
  "events": [
    {
      "type": "closed",
      "at": "2026-10-12",
      "by": "migration",
      "reason": "legacy",
      "words": "over before unit records existed; recorded when they were added"
    }
  ]
}
