{
  "id": "M5.E18",
  "legacy_row": [
    "**E18**",
    "✅ shipped as **v0.1.18** (2026-08-04)",
    "**The archive half, for the projects Epic-gating does not reach.** Both archive paths are Epic-gated **by construction** (`planArchiveMoves` filters through `EPIC_ID_STRICT_RE`; `deriveEpicArchiveDir` **throws** on a non-strict ID), so the halves that stop `.planning/` growing forever reach **4 of 12** readable projects. DISCUSS walked three real trees rather than quoting the backlog, and two findings reshaped the scope: **there is no single \"prefix\" to read** (eval-project-A has **10+ unit names**, some beginning with the word `PLAN`, so a declared-prefix field cannot express the shape), and **the retro requirement, not the prefix, is the harder blocker** (**none of the three projects has a single retrospective file**, so closure-by-retro returns *nothing is closed* everywhere). Confirmed by execution: `eval-project-C` carries `current_epic: PHASE12` while `detectMode` reports **linear**, so a not-current guard routed through any strict-gated helper receives `null`, **silently never fires**, and the unit being edited today becomes archivable — `B53`'s seam one field over. Requirements: [`M5.E18-REQUIREMENTS.md`](M5.E18-REQUIREMENTS.md) (FR1–FR6). Decisions D-M5E18-1…5. `B70` shipped **fix-lane** ahead of the build work. | **Shipped end-to-end: `/sig:migrate-memory` went from archiving 67 files across 1 of 12 real projects — all 67 Signal's own — to **114 across 6**.** `eval-project-C` 0 → 26. Seven slices: units derived from filenames (`work-units.js`), verdicts read as values (`verdict.js`), **three-outcome closure** (`closure.js` — `cannotDetermine` is a value, not a rendering decision), a stub retro is not closure, a non-Epic unit archives to `.planning/archive/{unit}/` (path-confined, 12 adversarial fixtures), and four statuses so `0` stops meaning both *could not look* and *checked and clean* (`B63`). **The closed-set is a UNION, measured in both directions:** retro-only sees 67 and is blind to 8 projects; verdict-only sees 110 but **loses 4** (`M5.E17` has a retro and no VERIFICATION, so the verdict rule reads a shipped Epic as running); either counts → 114, nothing lost. A **stub retro vetoes** closure regardless of verdict, or the union silently undoes `B64`. **S5 was planned as 2 sites and shipped as 5** — the sibling sweep, run FIRST rather than last, found `isStubRetro` had existed since M4.5.E9 and was consumed in **exactly one place**; every caller making a *decision* threw it away, including `checkEpicWithoutRetro`, **the check M5.E16 shipped eight days earlier to catch this**. **REVIEW returned FAIL** (a 112-LOC in-phase fix against a ≤ 50 cap — the *\"71 are deletions\"* argument rejected on the record) and the Epic looped back; the second VERIFY then found `AC4.5`'s half unreachable. **Three separate \"correct library code, no command path\" gaps, none caught by the same mechanism twice** — the Epic's most useful finding about itself. 1994 → **2168 tests**. Decisions D-M5E18-1…6. Bugs closed: `B64`, `B70`, `B72`, `B78`. Retro: [`M5.E18-RETROSPECTIVE.md`](M5.E18-RETROSPECTIVE.md)."
  ],
  "migration_note": "Recorded as closed (legacy) when unit records were added: a person confirmed the list it was in. Found: its milestone row says shipped (MILESTONE-5.md:42: “✅ shipped as **v0.1.18** (2026-08-04)”); its retrospective is complete (.planning/M5.E18-RETROSPECTIVE.md); today's closure check reads it closed (M5.E18-VERIFICATION.md records a PASS, and M5.E18 is not the current unit).",
  "events": [
    {
      "type": "closed",
      "at": "2026-10-12",
      "by": "migration",
      "reason": "legacy",
      "words": "over before unit records existed; recorded when they were added"
    }
  ]
}
